Sheet: Aggregate
A1: Array Robot Volume 1
A2: Aggregation Lambdas
B4: Count Each Unique Value
B6: CountEachUniqueValue(array,[exclude])
B7: Returns unique values in array except any exclude values and count of how many of each, sorted by highest count.
B10: array | F10: count of each unique value | I10: excluding blanks | L10: formulas
B12: A | C12: A | D12: B | F12: =CountEachUniqueValue(RC[-4]:R[3]C[-2]) -> C | G12: 3 | I12: =CountEachUniqueValue(RC[-7]:R[3]C[-5], "") -> C | J12: 3 | L12: =ShowFormulas(RC[-6]:R[6]C[-2]) -> F12: =CountEachUniqueValue(B12:D15)
B13: C | C13: C | D13: C | F13: A | G13: 2 | I13: A | J13: 2 | L13: I12: =CountEachUniqueValue(B12:D15, "")
B14: D | C14: D | D14: E | F14: D | G14: 2 | I14: D | J14: 2
B15: F | G15: 2 | I15: B | J15: 1
F16: B | G16: 1 | I16: E | J16: 1
F17: E | G17: 1 | I17: F | J17: 1
F18: F | G18: 1
B21: Running Product
B23: RunningProduct(array)
B24: Returns a running product of an array of values in same dimensions.
B26: array | D26: running product | F26: array | L26: formulas
B28: =SEQUENCE(5) -> 1 | D28: =RunningProduct(RC[-2]#) -> 1 | F28: =SEQUENCE(1,5) -> 1 | G28: 2 | H28: 3 | I28: 4 | J28: 5 | L28: =ShowFormulas(RC[-10]:R[4]C[-2]) -> B28: =SEQUENCE(5)
B29: 2 | D29: 2 | L29: D28: =RunningProduct(B28#)
B30: 3 | D30: 6 | F30: running product | L30: F28: =SEQUENCE(1,5)
B31: 4 | D31: 24 | L31: F32: =RunningProduct(F28#)
B32: 5 | D32: 120 | F32: =RunningProduct(R[-4]C#) -> 1 | G32: 2 | H32: 6 | I32: 24 | J32: 120
B35: Running Total
B37: RunningTotal(array)
B38: Returns a running sum of an array of values in same dimensions.
B40: array | D40: running total | F40: array | L40: formulas
B42: =SEQUENCE(5) -> 1 | D42: =LAMBDA(array, SCAN(0, array, LAMBDA(s,a, s + a)))(RC[-2]#) -> 1 | F42: =SEQUENCE(1,5) -> 1 | G42: 2 | H42: 3 | I42: 4 | J42: 5 | L42: =ShowFormulas(RC[-10]:R[4]C[-2]) -> B42: =SEQUENCE(5)
B43: 2 | D43: 3 | L43: D42: =LAMBDA(array, SCAN(0, array, LAMBDA(s,a, s + a)))(B42#)
B44: 3 | D44: 6 | F44: running total | L44: F42: =SEQUENCE(1,5)
B45: 4 | D45: 10 | L45: F46: =RunningTotal(F42#)
B46: 5 | D46: 15 | F46: =RunningTotal(R[-4]C#) -> 1 | G46: 3 | H46: 6 | I46: 10 | J46: 15
B49: Running Totals By Column/Row
B51: RunningTotalsByColumn(array)
B52: Returns a running sum of each column of an array of values.
B53: RunningTotalsByRow(array)
B54: Returns a running sum of each row of an array of values.
B56: array | F56: running totals by column | J56: running totals by row | N56: formulas
B58: =SEQUENCE(5,3) -> 1 | C58: 2 | D58: 3 | F58: =RunningTotalsByColumn(RC[-4]#) -> 1 | G58: 2 | H58: 3 | J58: =RunningTotalsByRow(RC[-8]#) -> 1 | K58: 3 | L58: 6 | N58: =ShowFormulas(RC[-12]:R[4]C[-2]) -> B58: =SEQUENCE(5,3)
B59: 4 | C59: 5 | D59: 6 | F59: 5 | G59: 7 | H59: 9 | J59: 4 | K59: 9 | L59: 15 | N59: F58: =RunningTotalsByColumn(B58#)
B60: 7 | C60: 8 | D60: 9 | F60: 12 | G60: 15 | H60: 18 | J60: 7 | K60: 15 | L60: 24 | N60: J58: =RunningTotalsByRow(B58#)
B61: 10 | C61: 11 | D61: 12 | F61: 22 | G61: 26 | H61: 30 | J61: 10 | K61: 21 | L61: 33
B62: 13 | C62: 14 | D62: 15 | F62: 35 | G62: 40 | H62: 45 | J62: 13 | K62: 27 | L62: 42
B65: Sum By Column/Row
B67: SumByColumn(array)
B68: Returns sum of each column of an array of values.
B69: SumByRow(array)
B70: Returns sum of each row of an array of values.
B72: array | F72: sum by columns | J72: sum by rows | L72: formulas
B74: =SEQUENCE(5,3) -> 1 | C74: 2 | D74: 3 | F74: =SumByColumn(RC[-4]#) -> 35 | G74: 40 | H74: 45 | J74: =SumByRow(RC[-8]#) -> 6 | L74: =ShowFormulas(RC[-10]:R[4]C) -> B74: =SEQUENCE(5,3)
B75: 4 | C75: 5 | D75: 6 | J75: 15 | L75: F74: =SumByColumn(B74#)
B76: 7 | C76: 8 | D76: 9 | J76: 24 | L76: J74: =SumByRow(B74#)
B77: 10 | C77: 11 | D77: 12 | J77: 33 | L77: L74: =ShowFormulas(B74:L78)
B78: 13 | C78: 14 | D78: 15 | J78: 42