Sheet: Array
A1: Array Robot Volume 1
A2: Array Manipulation Lambdas
B4: Remove Columns/Rows
B6: RemoveCols(array, column_indexes)
B7: Returns all columns of array except the ones specified in column_indexes.
B8: RemoveRows(array, row_indexes)
B9: Returns all rows of array except the ones specified in row_indexes.
B11: array | H11: remove columns 2 and 4 | L11: remove rows 3 and 5 | P11: formulas
B13: =SEQUENCE(5, 5) -> 1 | C13: 2 | D13: 3 | E13: 4 | F13: 5 | H13: =RemoveCols(RC[-6]#, {2,4}) -> 1 | I13: 3 | J13: 5 | L13: =RemoveRows(RC[-4]#, {3,5}) -> 1 | M13: 3 | N13: 5 | P13: =ShowFormulas(RC[-14]:R[4]C[-2]) -> B13: =SEQUENCE(5, 5)
B14: 6 | C14: 7 | D14: 8 | E14: 9 | F14: 10 | H14: 6 | I14: 8 | J14: 10 | L14: 6 | M14: 8 | N14: 10 | P14: H13: =RemoveCols(B13#, {2,4})
B15: 11 | C15: 12 | D15: 13 | E15: 14 | F15: 15 | H15: 11 | I15: 13 | J15: 15 | L15: 16 | M15: 18 | N15: 20 | P15: L13: =RemoveRows(H13#, {3,5})
B16: 16 | C16: 17 | D16: 18 | E16: 19 | F16: 20 | H16: 16 | I16: 18 | J16: 20
B17: 21 | C17: 22 | D17: 23 | E17: 24 | F17: 25 | H17: 21 | I17: 23 | J17: 25
B20: Reverse Columns/Rows
B22: ReverseColumns(array)
B23: Returns array with columns in reverse order.
B24: ReverseRows(array)
B25: Returns array with rows in reverse order.
B27: array | G27: reverse columns | L27: reverse rows | Q27: formulas
B29: =SEQUENCE(4,4) -> 1 | C29: 2 | D29: 3 | E29: 4 | G29: =ReverseColumns(RC[-5]#) -> 4 | H29: 3 | I29: 2 | J29: 1 | L29: =ReverseRows(RC[-5]#) -> 16 | M29: 15 | N29: 14 | O29: 13 | Q29: =ShowFormulas(RC[-15]:R[3]C[-2]) -> B29: =SEQUENCE(4,4)
B30: 5 | C30: 6 | D30: 7 | E30: 8 | G30: 8 | H30: 7 | I30: 6 | J30: 5 | L30: 12 | M30: 11 | N30: 10 | O30: 9 | Q30: G29: =ReverseColumns(B29#)
B31: 9 | C31: 10 | D31: 11 | E31: 12 | G31: 12 | H31: 11 | I31: 10 | J31: 9 | L31: 8 | M31: 7 | N31: 6 | O31: 5 | Q31: L29: =ReverseRows(G29#)
B32: 13 | C32: 14 | D32: 15 | E32: 16 | G32: 16 | H32: 15 | I32: 14 | J32: 13 | L32: 4 | M32: 3 | N32: 2 | O32: 1
B35: Unpivot Array/Unpivot Array By Specified Columns
B37: Unpivot(table, [columns_to_unpivot], [attribute_name], [value_name], [remove_blanks])
B38: Given a table with a single header row, returns a table with the columns_to_unpivot converted into an Attribute column with all corresponding values in a Value column.
B40: The names of the Attribute and Value columns can be overwritten using attribute_name and value_name parameters.
B41: By default, blank cells are removed, but this can be changed by passing FALSE to remove_blanks parameter.
B42: Note: columns_to_unpivot do not need to be the right-most columns, but do need to be consecutive columns.
B44: table | G44: simple unpivot | K44: specify column names | O44: formulas
B46: Name | C46: Europe | D46: Asia | E46: Africa | G46: Name | H46: Attribute | I46: Value | K46: Name | L46: Region | M46: Sales | O46: =ShowFormulas(RC[-13]:R[6]C[-2]) -> G46: =Unpivot(B46:E49)
B47: Joe | C47: 52 | D47: 21 | G47: Joe | H47: Europe | I47: 52 | K47: Joe | L47: Europe | M47: 52 | O47: K46: =Unpivot(B46:E49,,"Region","Sales")
B48: Bob | D48: 7 | E48: 33 | G48: Joe | H48: Asia | I48: 21 | K48: Joe | L48: Asia | M48: 21
B49: Sue | C49: 65 | E49: 111 | G49: Bob | H49: Asia | I49: 7 | K49: Bob | L49: Asia | M49: 7
G50: Bob | H50: Africa | I50: 33 | K50: Bob | L50: Africa | M50: 33
G51: Sue | H51: Europe | I51: 65 | K51: Sue | L51: Europe | M51: 65
G52: Sue | H52: Africa | I52: 111 | K52: Sue | L52: Africa | M52: 111
B55: table | I55: unpivot just the region columns | O55: formulas
B57: Name | C57: Manager | D57: Europe | E57: Asia | F57: Africa | G57: Total | I57: Name | J57: Manager | K57: Region | L57: Sales | M57: Total | O57: =ShowFormulas(RC[-13]:R[6]C[-3]) -> I57: =Unpivot(B57:G60,D57:F57,"Region","Sales")
B58: Joe | C58: Amy | D58: 52 | E58: 21 | G58: 73 | I58: Joe | J58: Amy | K58: Europe | L58: 52 | M58: 73
B59: Bob | C59: Tom | E59: 7 | F59: 33 | G59: 40 | I59: Joe | J59: Amy | K59: Asia | L59: 21 | M59: 73
B60: Sue | C60: Pam | D60: 65 | F60: 111 | G60: 176 | I60: Bob | J60: Tom | K60: Asia | L60: 7 | M60: 40
I61: Bob | J61: Tom | K61: Africa | L61: 33 | M61: 40
I62: Sue | J62: Pam | K62: Europe | L62: 65 | M62: 176
I63: Sue | J63: Pam | K63: Africa | L63: 111 | M63: 176